id,title,companyName,companyLocation,summary
444bd32c9e95004a,[대형증권사] IT퀀트 개발자,인코리아 프로페셔널,서울 강남구,"로세스에 대한 이해학력사항: 대학교(4년)졸업 - 이공계 전공, C#, Python,JavaScript,SQL 사용 가능 우대 0 명 근무조건 고용형태... 통신·모바일·게임>웹프로그래머> Python|인터넷·IT·통신·모바일·게임..."
9334c807e0fc3194,[Server] 서버 개발자 (인터널 서비스),한국카카오은행,성남 분당구,"용한 서버 개발경험이 있는 분· Python, node.js 등의 스크립트... 그래머> Python|인터넷·IT·통신·모바일·게임>응용프로그래머>Linux|인터넷·IT·통신·모바일·게임>빅데이터·AI(인공지능)> Python|인터넷..."
9518633e4ddd93aa,[Manta] 데이터분석가,RIDI Corp,서울,"이상의 모바일 앱 및 웹의 고객 행동 데이터 분석을 통한 서비스 개선 경험 데이터 처리 언어(SQL, R, Python, Scala 등)와 BI툴(Tableau, Power BI 등)에 대한 지식을 보유하고 계신 전문가 빠르..."
b40a09bb26c18930,"S/W개발자, H/W개발자, 기구설계 전문가",뉴로직,서울 강서구,"집부문 담당업무 자격요건 인원 S/W개발자H/W개발자기구설계직 [담당업무][S/W 개발]- C, C++, Python 프로그래밍 가능- 영상 처리, 컴퓨터 비전, 머신러닝, 비디오 스트리밍 관련 개발 경력 보유- OpenCV..."
f5c40ec89231fd10,음성인식 서버 개발 및 운영 전문가,에스케이텔레콤,서울 종로구,"기반의 API 설계 및 개발 경험개발 역량– C/C++, Java, Python, shell script 등 리눅스 환경 실무 개발 가능– 병렬화 및... 통신·모바일·게임>응용프로그래머> Python|인터넷·IT·통신·모바일·게임..."
b03b8655f632f8f0,[네오컨버전스] 딥러닝 개발자 신입/경력 정규직,네오컨버전스,서울 성동구,"부설연구소 [자격요건]신입, 경력(연차무관)대학교(4년)졸업 이상- Python 개발 가능자- Pytorch 딥러닝 프레임 워크 경험자- 딥러닝 이해... 게임>빅데이터·AI(인공지능)> Python|인터넷·IT·통신·모바일·게임..."
dae1d26d25c1ee21,[Beluga] 음성 (TTS/STT) 딥러닝 엔지니어 (경력 무관),크래프톤,서울 강남구,경험을 보유하신 분독창적인 기술 제시 및 문제 해결을 위한 프로그래밍 능력을 보유하신 분 (C/C++/ Python/shell 등)오픈소스 기반 딥 러닝 프레임워크 활용 능력을 보유하신 분 (PyTorch/TensorFlow...
3bb02c9776a47dd7,"솔루션 기반 프로그래머(java, c#, python)",솔브리드플러스,서울 금천구,"업무- 개발자 역할로 프로젝트 수행- BIOVIA 솔루션 관련 교육을 통해 기능 숙지 및 java, C#, Python 등을 사용하여 개발업무 분담 [근무시간 및 형태] 주 5일 근무 (오전) 9시 00분~(오후) 6시 00..."
22cd969d8399e6a3,1분기 게임 클라이언트 개발자 (신입/경력),이스트게임즈,서울 서초구,"분 * C/C++, C#, Swift, Objective C, Kotlin, Java, JavaScript, Python, Go.새로운 프로그래밍 언어를 습득하는데 어려움이 없거나 혹은 흥미를 갖고 있는 분게임엔진 사용 경험..."
a5e926e1d22cdc11,각 분야별 인재 Pool 등록,지투알,서울,"자 - 데이터 분석 툴(Adobe Analytics 또는 Google Analytics) 유경험자 우대 - Python, R, SQL 역량 보유자 우대 - 데이터에 기반한 문제해결 능력 및 통계학적 지식 보유자 우대 - 담당..."
45270f7fa037cf9c,"2022년 상반기 주식회사 쏘마 전 개발 직군 (백엔드, 프론트엔드 외 신입/경력 정규직)",쏘마,성남 분당구,트엔드|인터넷·IT·통신·모바일·게임>웹프로그래머> Python|인터넷·IT·통신·모바일·게임>응용프로그래머>C·C++|인터넷·IT·통신·모바일·게임>응용프로그래머> Python|인터넷·IT·통신·모바일·게임>빅데이터·AI(인공...
acb4e1b4a0a34f47,Security Engineer,Amazon Web Services Korea LLC,서울,"C, C++... Java • Experience with scripting (e.g. python, ruby, bash) • Knowledge of common wireless connectivity..."
677cee81b4f6e955,데이터분석가 - Global Leading Consulting Firm,에스에프인촌,서울,모바일·게임>빅데이터·AI(인공지능)>데이터분석|인터넷·IT·통신·모바일·게임>빅데이터·AI(인공지능)> Python|인터넷·IT·통신·모바일·게임>빅데이터·AI(인공지능)>인공지능(AI)|마케팅·광고·홍보·조사>조사·분석...
c04680232735292a,가상자산 트레이딩 / 시스템 개발자,블록투리얼,서울 강남구,및 제출서류에 허위사실이 있을 경우 채용이 취소될 수 있습니다. 금융·보험·증권>투자·분석·증권·외환>자산관리|인터넷·IT·통신·모바일·게임>응용프로그래머> Python|인터넷·IT·통신·모바일·게임>응용프로그래머>C·C++
69a5690f8a4ca470,Software Engineer (소프트웨어 개발자),지멘스헬시니어스,성남 분당구,"대졸 이상2. C/C++, C#, Python 등의 언어로 소프트웨어 개발... 용프로그래머>C·C++|인터넷·IT·통신·모바일·게임>응용프로그래머> Python|인터넷·IT·통신·모바일·게임>전산·IT기술지원>S/W 엔지니어|인터..."
d8918f984b349ea6,[국비무료/취업연계] 실무프로젝트 기반 빅데이터/핀테크/인공지능 연수생,아시아경제,서울 중구,통신·모바일·게임>웹프로그래머> Python|인터넷·IT·통신·모바일·게임... 프론트엔드|인터넷·IT·통신·모바일·게임>빅데이터·AI(인공지능)> Python|인터넷·IT·통신·모바일·게임>빅데이터·AI(인공지능)>인공지능(AI...
e1f6164f1d03449a,주식회사 데이터스트림즈 기술연구소 Python/Java 개발자,데이터스트림즈,성남 분당구,데이터스트림즈 기술연구소 Python/Java 개발자 채용 모집부문 및 자격요건 담당업무 자격요건 우대사항 Python/Java 개발 직군 경력직... 통신·모바일·게임>웹프로그래머> Python|인터넷·IT·통신·모바일·게임...
7a165c95f20fa6aa,[신입/경력] 스마트 교통 시스템 임베디드 소프트웨어 개발자,몹티콘,서울 구로구,"1) 주요 업무 분야 : 머신 비젼, 영상 처리, 딥러닝 알고리즘 2) 사용 언어 : C, C++, Python 3) TensorFlow, Deep Learning 관련 지식 보유자 우대 4) Vision, Image..."
e00d3977d633da67,[쿠키런: 오븐브레이크] 데이터 분석가 (경력),데브시스터즈,서울 강남구,통신·모바일·게임>ERP·시스템분석·설계>데이터분석|인터넷·IT·통신·모바일·게임>응용프로그래머> Python|인터넷·IT·통신·모바일·게임>웹프로그래머> Python|인터넷·IT·통신·모바일·게임>데이터베이스·DBA>SQL
e7c8c2b11f24fb43,Software Engineer,Google,서울,"languages, including... limited to: C++, Java, C and Python. Excellent written and verbal communication skills. About..."
3e7b756ca8ec169f,가상화 엔지니어 정규직,다원커리어,서울 서초구,DM/NV 등) 우대사항 1) 정보처리산업기사 이상의 자격을 보유하신 분 2) PowerShell/Bash/ Python 등 System Script 경험이 있는 분 기타정보 1) 삼성전자 반도체 사업장 VMware 가상화...
114ce6ec44362f44,[TmaxEdu/R&D] 연구 개발자,티맥스소프트,성남 분당구,"CSS, JavaScript, TypeScript [Server 개발(사용 언어)] - Java, Python, SQL [Framework(사용 언어)] - React.js, Spring [입사 지원 시 참고 사항..."
3617e30a1af44426,[NHN SOFT] Back-End 경력 개발자,엔에이치엔소프트,성남 분당구,통신·모바일·게임>웹프로그래머> Python|인터넷·IT·통신·모바일·게임... 로그래머>증강현실(AR)|인터넷·IT·통신·모바일·게임>응용프로그래머> Python|인터넷·IT·통신·모바일·게임>응용프로그래머>머신러닝(ML)|인터넷...
93d196ee3158a5c0,보안전문 기업 씽크에이티와 함께할 개발자,씽크에이티,서울 구로구,"globalcall api - asterisk 연동 환경 : node.js - 시스템 운영 관리 언어 : python, 쉘 스크립트 - MFC 인프라 운영 운영체제 운영 관리 경험. - CentOS 5,6,7 - RHEL 5..."
d83fc0dd2641f483,전문연구요원 (병역특례) 수시 (AI / SW 분야),딥엑스,성남 분당구,요구 능력] - ASM/C/C++/ Python 언어 코딩 기술 - 운영체제... 경험 - Windows/Linux 상에서 C++/ Python 언어 사용 개발 경험 - C++ / Python 언어 사용 개발 경험 - 객체지향 설계에...
69ab906877d48391,1분기 웹 개발자 (신입/경력),이스트게임즈,서울 서초구,"purpose 프로그래밍 언어로 소프트웨어를 개발한 경험이 있는 분 * Java, JavaScript, Python, Swift, Kotlin. 인터넷·IT·통신·모바일·게임>게임(Game)>게임퍼블리싱|인터넷·IT·통신..."
c4145dce440c02f8,[전문연구요원 신규편입/전직] SW Engineer/Backend/Frontend 개발자,뷰노코리아,서울 서초구,백엔드|인터넷·IT·통신·모바일·게임>웹프로그래머>프론트엔드|인터넷·IT·통신·모바일·게임>웹프로그래머> Python|인터넷·IT·통신·모바일·게임>응용프로그래머>Linux|인터넷·IT·통신·모바일·게임>응용프로그래머>인공지능...
f54bac6c78fd3240,코딩에 빠진 수퍼 개발자 (펌웨어 개발),에바,성남 수정구,"학력무관직무기술: 펌웨어(Firmware), Embedded System S/W 개발(판교) c/c++, Python 3 명 근무조건 고용형태: 정규직근무부서: 개발팀급여조건: 연봉 협의 후 결정 전형단계 및 제출서류 전형단..."
fb4d29cc4e9ea24a,Data Scientist,뱅크샐러드,서울 영등포구,"기반 예측, 모델링 프로젝트 경험자 데이터 분석/모델링을 위한 언어 및 프레임워크 사용에 익숙하신 분 ( Python, R, SQL, Pandas, TensorFlow, Pytorch, Spark 등) 회사 내부 구성원들과..."
7aa9c0db8d7febd2,빅데이터 플랫폼 데이터 엔지니어,LG이노텍,서울 마곡역,"험자 - S/W 관련 자격증 보유자 - AWS (Redshift, S3 등) 기반 시스템 구축 경험자 - Python, SAS 스킬 보유자 - DB영역 기술 전문성 보유자 - IT 전반에 대한 이해도와 경험 보유자 필수 지원..."
bbbfbb33164df0e3,"Junior Software Engineer, Server Platform",Sendbird,서울,"프라 위에 안정적이고 효율적인 서비스 설계 및 구축 핵심 자격요건 Python, Java, Kotlin, Go, C++ 등 서버 사이드 프로그래밍... Understanding of Python, Java, and Event..."
19da3484bd7a72f1,Machine Learning R&D 연구원,카이어,서울 서초구,"가능) ㆍ최신 딥러닝, 기계학습 이론에 대한 이해 및 구현 역량 ㆍ Python, TnsorFlow, C/C++, TensorRT 등 프로그래밍 실무... 대한 이해 및 구현 역량 ㆍ Python, TnsorFlow, C/C++..."
69d3cc2cca262747,Machine Learning Engineer Intern - Korea,MOLOCO,서울,"Strong algorithms and data structure skills. Fluent... least one programming language including Python, Java, and Golang."
c35e9b72a11aa338,[신입/경력] 의료영상/음성인식/생체신호 연구원,뷰노코리아,서울 서초구,게임>빅데이터·AI(인공지능)>인공지능(AI)|인터넷·IT·통신·모바일·게임>빅데이터·AI(인공지능)>딥러닝|인터넷·IT·통신·모바일·게임>응용프로그래머>C·C++|인터넷·IT·통신·모바일·게임>응용프로그래머> Python
26fc3f142982bbed,스마트폰 어플리케이션(App) 경력 정규직,엠마헬스케어,성남 분당구,"iOS에서 충분한 개발 경험 • Java, javascript 또는 Python 언어로 APP 개발 경험 보유 • RESTful API 연동 경험자... javascript 또는 Python 언어로 APP 개발 경험 보유..."
d048ae09bb3258fc,[NAVER Z] 데이터 엔지니어,네이버제트,성남 분당구,"서비스 API 개발 및 운영자격요건 및 필요역량- 관련 분야 개발 경력 3년 이상- Scala/Java/ Python, Spark, Kafka(Stream) 기반 빅 데이터 처리 경험이 있으신 분- 빅데이터 엔지니어링 도구에..."
62d77051fa88c8d2,Plant Purchasing (양산 구매),비테스코테크놀로지스코리아,경기도 이천,"office 활용 능력최신 정보 분석 도구 활용 능력 우대 (KNIME, Power BI, UiPath, Python, RPA 등 경영·인사·총무·사무>구매·자재>외자구매|경영·인사·총무·사무>구매·자재>자재구매|경영·인사..."
61b23b6cfda8ab6c,데이터 분석가 (신입/경력),게임빌컴투스플랫폼,서울 금천구,빅데이터·AI(인공지능)>빅데이터|인터넷·IT·통신·모바일·게임>빅데이터·AI(인공지능)>데이터분석|인터넷·IT·통신·모바일·게임>빅데이터·AI(인공지능)> Python|인터넷·IT·통신·모바일·게임>데이터베이스·DBA>SQL
4c25d6649f8434a8,[외국계 스타트업 미소] Business Analyst Intern (정규직 전환형),유한회사 미소,서울,통신·모바일·게임>빅데이터·AI(인공지능)>데이터분석|인터넷·IT·통신·모바일·게임>빅데이터·AI(인공지능)> Python|인터넷·IT·통신·모바일·게임>데이터베이스·DBA>MySQL|인터넷·IT·통신·모바일·게임>데이터베이스...
dce9169c36eaaf92,[SAPEON Korea] Deep Learning Library 개발자,에스케이텔레콤,성남 분당구,통신·모바일·게임>빅데이터·AI(인공지능)>데이터분석|인터넷·IT·통신·모바일·게임>빅데이터·AI(인공지능)> Python|인터넷·IT·통신·모바일·게임>빅데이터·AI(인공지능)>머신러닝|인터넷·IT·통신·모바일·게임>빅데이터...
1bc6c09051f1d591,AI Research Engineer,Intel,서울,"PyTorch, Caffe, and MxNet - Strong programming skills with Python and C/C++ - Experiences in programming and testing on Linux..."
39d930f25b6d9e8e,AI Scientist (NL Reasoning),MIND AI,서울 중구,"taxonomies, and semantic networks * Knowledge of Python, Lisp, or another scripting language * Expertise in general..."
2e46f8b2ba482821,"Customer Engineer, Data Analytics, Google Cloud",Google,서울,"writing code in a common development language... Java, Python, JavaScript, C++, Scala, R or Go. About the job..."
5563ce7ab78d268d,Network Advanced Services Engineer,Arista Networks,서울,"network provisioning automation using Python and tools... Chef or Ansible... Background in Perl, Python, Scripting..."
40de6a4b81f8724f,[전문연구요원 신규편입/전직] 의료영상/음성인식/생체신호 연구원,뷰노코리아,서울 서초구,인공지능)>텍스트마이닝|인터넷·IT·통신·모바일·게임>빅데이터·AI(인공지능)>인공지능(AI)|인터넷·IT·통신·모바일·게임>빅데이터·AI(인공지능)> Python|인터넷·IT·통신·모바일·게임>빅데이터·AI(인공지능)>딥러닝
b02be4ea99e5903d,[Engineering Div.] Esports Engineer (4년 이상),크래프톤,서울 강남구,"개발 Python, C#(.NET Core), Javascript, Docker, AWS 이런 경험을 가진 분과 함께 성장하고 싶습니다! Python... 래머> Python|인터넷·IT·통신·모바일·게임>응용프로그래머> Python..."
82d47e44be45bb97,Junior Structural Engineer,SYSTRA,서울,"Structural Modeling software : Midas, Sofistik… IT language: Python (nice to have) . Job Segment: Construction, Engineer..."
f02b84b51cccea64,2022년 2월 R&D 석박사 신입 (BMS/System/DX),LG에너지솔루션,과천 과천시,"해석모델 구축 (CFD, CAE 등) • 가상 검증 기반의 전지 제조 공정 시뮬레이터 개발 (Matlab, Python 등) 1) 석사/박사 학위 소지자 또는 2022년 8월 석사/박사 학위 취득 예정자 ※석박통합과정 진행중..."
3c1c5dc51d08cf18,Web / Spring Framework 개발자,에릭슨엘지,서울 금천구,게임>웹프로그래머>JAVA|인터넷·IT·통신·모바일·게임>웹프로그래머> Python|인터넷·IT·통신·모바일·게임>웹프로그래머>ASP|인터넷·IT·통신... 통신·모바일·게임>응용프로그래머> Python|인터넷·IT·통신·모바일·게임...
f0fa048255eee14e,"인공지능(AI), 머신러닝(ML) 외 경력 정규직",시스메틱,서울 영등포구,모바일·게임>응용프로그래머>인공지능(AI)|인터넷·IT·통신·모바일·게임>응용프로그래머>머신러닝(ML)|인터넷·IT·통신·모바일·게임>응용프로그래머> Python|인터넷·IT·통신·모바일·게임>소프트웨어·하드웨어>소프트웨어
c0f290b9dc436e3a,음성신호 처리/개발 부문 경력,현대오토에버,서울 강남구,등 open source DL framework에 대한 구현 경험 - Python/Javascript 개발 경력 3년 이상 혹은 그에 준하는 실력... 게임>빅데이터·AI(인공지능)> Python|인터넷·IT·통신·모바일·게임...
53123195365ac509,Validation Manager (CSS 모형),비바리퍼블리카,서울 강남구,SQL|마케팅·광고·홍보·조사>조사·분석·통계>통계·SAS|인터넷·IT·통신·모바일·게임>응용프로그래머> Python|인터넷·IT·통신·모바일·게임>응용프로그래머>머신러닝(ML)|인터넷·IT·통신·모바일·게임>빅데이터·AI...
c0574107a4de85c1,로데슈바르즈코리아 연구소 개발자,로데 슈바르즈 코리아,서울 강남구,"소프트웨어 개발 혹은 시스템 통합 경험을 보유하신 분으로 경력 1년 ~ 3년ㆍ프로그래밍 언어 C/C++, Pythonㆍ적극적으로 동료들과 소통하고 책임감이 있는 분ㆍ새로운 기술 습득에 열정이 있으신 분ㆍ비지니스 수준의 영어..."
55a19c92c845685e,Developer / Designer recruit,마이뮤직테이스트,서울 논현동,"language (i.e Python, Ruby, Java, .Net... High proficiency in Python... knowledge... least one Python web framework..."
093aff756539c03b,Mid-level Software Engineer (AvionX),BOEING,서울,"software coding more than 1+ software languages (e.g. C, C++, Python, Simulink and so on) Proper English communication skill..."
ec5c7ccd76639120,[외국계 스타트업 미소] Data Analyst,유한회사 미소,서울,통신·모바일·게임>빅데이터·AI(인공지능)>데이터분석|인터넷·IT·통신·모바일·게임>빅데이터·AI(인공지능)> Python|인터넷·IT·통신·모바일·게임>데이터베이스·DBA>MySQL|인터넷·IT·통신·모바일·게임>데이터베이스...
b2eb1fe78ff9ee5f,[대기업] 데이터분석가 경력 (대리~과장급 2명),에이치알니즈,서울,"경력5년 이상-통계분석과 Machine Learning알고리즘에 대한 기본지식 보유-SQL, SAS, R, Python 중2개 이상의 분석도구에 대한 기본 이해-현상에 대한 문제인식과 적극적인 문제해결의지-통계적 수치에 대한..."
587040f5f3bb4c26,[대기업] 클라우드 서비스 솔루션 개발,비에이블컨설팅그룹,서울,C++|인터넷·IT·통신·모바일·게임>응용프로그래머>클라우드|인터넷·IT·통신·모바일·게임>응용프로그래머> Python|인터넷·IT·통신·모바일·게임>데이터베이스·DBA>데이터베이스개발자|인터넷·IT·통신·모바일·게임>데이터베...
649ccf047c868778,"금융 데이터 분석 엔진, 로보어드바이저 개발자",에스비씨엔,서울 영등포구,"시스템, 머신러닝, 자연어처리. 패턴분석 - 다음 언어에서 최소 한 가지 이상 능숙자: Java, C++, Python, JavaScript 우대사항 - 석사이상 컴퓨터공학 (Computer Science) 분야 또는..."
8f98e142241884a4,[연구개발 부문] 연구원 (MCU 계측제어설계/머신비전/이미지프로세싱),모든,경기도 광명,"프로그래밍 가능자 우대S/W 설계 부문 : - OPEN CV, TENSORFLOW, YOLO, CUDA/ Python, C++, C WindowsGUL APL, MFC Lib 활용 가능자. 머신비전/ 영상처리 개발자* 전기..."
ccd4f5407a32ba6a,Data Scientist,Boston Consulting Group,서울,"analysis a plus, Programming... scripting exp.: eg. Python, C#, VBA, Java, Perl, etc. Experience in applied analytics..."
df228c302c3c8f9b,서버개발자(벡앤드) 정규직,오비이랩,서울 강남구,시스템 개발 [자격요건]• 경력사항: 경력(3년 이상 7년 이하)• 학력사항: 학력무관• 중상급 이상의 Python 또는 JavaScript 언어 활용 가능자• Django 또는 Node.js rest framework에...
3b7dbdf85a326a6d,국내 대기업 - AI 및 딥러닝 관련 경력자,라피플코리아리미티드,서울,"관련 전문 지식 있는 분 - Python 또는 Scala, JAVA 활용... 레임워크 활용 역량 좋은 분- 자연어처리 관련 전문 지식 있는 분- Python 또는 Scala, JAVA 활용 역량- 미디어/커머스/전자/IT 업계..."
891485cc2a8e6779,인공지능 솔루션 (AI Solution) 개발,카이어,서울 서초구,Detection 등) 개발 경험• Python Library 사용 경험... 그래머>머신러닝(ML)|인터넷·IT·통신·모바일·게임>응용프로그래머> Python|인터넷·IT·통신·모바일·게임>빅데이터·AI(인공지능)>인공지능(AI...
d49618d656468d9b,데이터 분석가,파이프트리스마트팜,서울 송파구,"및 분석, 개선- 서비스화를 위한 플랫폼 적용✔️ 필요 역량입니다.- 분석 업무 3~10년 이하 이신 분- python 언어를 통한 분석 가능하신 분- 분석을 통한 실제 비즈니스 문제 해결 경험- 다양한 직군과의 커뮤니케이션..."
0a57a69a13126ff5,셀프 인테리어 위한 AI 플랫폼 서비스 개발자,서르,성남 분당구,이상의 python 또는 node.js실무 개발경험이 있는 분 -Restful API에 대한 이해와 실무경험이 있는 분 인터넷·IT·통신·모바일·게임>웹프로그래머>웹개발|인터넷·IT·통신·모바일·게임>웹프로그래머> Python...
3d628d5125cef3b0,[대형증권사] 파생퀀트,인코리아 프로페셔널,서울 강남구,통신·모바일·게임>웹프로그래머>JAVA|인터넷·IT·통신·모바일·게임>웹프로그래머>프론트엔드|인터넷·IT·통신·모바일·게임>웹프로그래머> Python|인터넷·IT·통신·모바일·게임>웹프로그래머>HTML·DHTML·mHTML
192c20f6f0f64ab3,[2022 전문연구요원] AI R&D - Language AI,엔씨소프트,성남 판교역,"기술을 서비스에 적용하기 위한 MLOps 플랫폼을 개발합니다. 지원자격 학력 : 석사 이상 필수조건 - Python, Java등 한 가지 이상의 컴퓨터 프로그래밍 언어를 활용할 수 있으신 분 - 머신러닝/딥러닝 기술에 대한..."
5dd25746d945e947,빅데이터분석 담당자 in 자원순환 모바일 앱 스타트업,그레이프 파트너즈,서울 성동구,AI(인공지능)>빅데이터|인터넷·IT·통신·모바일·게임>빅데이터·AI(인공지능)>데이터분석|인터넷·IT·통신·모바일·게임>빅데이터·AI(인공지능)> Python|인터넷·IT·통신·모바일·게임>빅데이터·AI(인공지능)>자연어처리
0229342521a71f63,(주)리얼데이터 분석컨설팅 인력,리얼데이터,서울 성동구,이터·AI(인공지능)>데이터마이닝|인터넷·IT·통신·모바일·게임>빅데이터·AI(인공지능)>빅데이터|인터넷·IT·통신·모바일·게임>빅데이터·AI(인공지능)> Python|인터넷·IT·통신·모바일·게임>빅데이터·AI(인공지능)>R
00b0f4d1f5f56d14,모바일 운영서비스 빌드/배포/테스트 자동화 개발자,브롤브,서울 마포구,"와 같은 컨테이너 기반 기술 이해 및 경험- 리눅스 환경에 대한 경험- 기본 스크립트 언어 경험 : Python / Bash / Perl 등- 지속적 통합 (Jenkins, Fastlane) 이해 및 경험- 소스형상관리..."
cae2de07045cfb2b,"Java, Python 영상툴 개발자",에이아이메이커,서울 마곡동,원하면 가능) 담당업무 - 영상 라벨링 Tool 개발 - Tool 정확성 개선 자격요건 - Java - Python 우대사항 - 관련 개발 경력 - 툴개발 경력 근무조건 - 월~금 AM9:30 ~ PM18:30 복지...
375d31c1f3157770,Machine Learning Engineer,3i,서울,"statistics and algorithms • Ability to write robust code in Python, Java and R • Familiarity with machine learning..."
98a3e3328fec92db,데이터 엔지니어,Bagelcode,서울,"end pipeline의 개발 ( Python, Airflow, k8s 활용... 데이터베이스 등 기본적인 전산 지식에 대한 이해를 갖추신 분 - Python / Java / Scala / Kotlin / Go 등의 언어로 개발..."
86492ed4ce55a53e,[자동차부품 우량대기업] ADAS Vision System SW개발 경력인재,에스에프인촌,서울,C·C++|인터넷·IT·통신·모바일·게임>응용프로그래머>Linux|인터넷·IT·통신·모바일·게임>응용프로그래머> Python|인터넷·IT·통신·모바일·게임>통신·모바일>커넥티드카 개발자|인터넷·IT·통신·모바일·게임>소프트웨어...
4d08d3e1f1815e21,현대백화점 H.Point팀 데이터 분석/기획 경력,현대백화점,서울 삼성역,"적용 모델링 - OLAP툴, R, Python, SQL 등 활용 분석 수행 및 리포팅 - 학사 이상 학위 취득자 - OLAP툴 사용 경험(3년 이상) - R, Python, SQL 등 심화 분석툴 경험(2년..."
4cc15c26097421c5,"개발자 - Python 프로그래밍과 Java, C 소스코드 분석",바인테크,서울 송파구,"자격요건 인원 [담당업무]개발자 - Python 프로그래밍과 Java, C 소스코드 분석[근무부서 및 직급/직책]근무부서: 엔터프라이즈 솔루션직급/직책: 팀원, 대리, 차장 [필요기술]ㆍ Python 프로그래밍과 Java, C..."
9d65190a07b1dcd7,Data Science Executive,NielsenIQ,서울,using tools... python/r. Understand... You’ve dabbled in data. You’ve perused Python. And you have the communication chops...
